{
  "name": "Commodore PET 2001-8",
  "cpu": {
    "type": "mos6502",
    "resetVector": "0xFFFC"
  },
  "memory": [
    { "type": "ram", "start": "0x0000", "size": "0x2000", "label": "RAM 8KB" },
    { "type": "ram", "start": "0x8000", "size": "0x0400", "label": "Video RAM" },
    { "type": "rom", "start": "0xC000", "size": "0x1000", "file": "basic-c000.bin", "label": "BASIC C000" },
    { "type": "rom", "start": "0xD000", "size": "0x1000", "file": "basic-d000.bin", "label": "BASIC D000" },
    { "type": "rom", "start": "0xE000", "size": "0x0800", "file": "editor.bin", "label": "Editor" },
    { "type": "rom", "start": "0xF000", "size": "0x1000", "file": "kernal.bin", "label": "Kernal" }
  ],
  "display": {
    "cols": 40,
    "rows": 25,
    "font": "pet"
  }
}
