{
  "name": "Commodore C16",
  "cpu": { "type": "mos6502", "resetVector": "0xFFFC" },
  "memory": [
    { "type": "ram", "start": "0x0000", "size": "0x8000", "label": "RAM 32KB" },

    { "type": "rom", "start": "0xC000", "size": "0x4000", "file": "basic-318006-01.bin", "label": "BASIC+Kernal" }
  ],
  "display": { "cols": 40, "rows": 25, "font": "ted" }
}
